{
  "version": 1,
  "meta": {
    "name": "demo",
    "title": "Vì sao điện thoại biết bạn ở đâu",
    "language": "vi",
    "series": null,
    "episode": null,
    "created": "2026-10-21T05:09:26.431Z"
  },
  "brand": {
    "ref": "brand/brand.json",
    "version": null
  },
  "format": {
    "aspect": "16:9",
    "width": 1920,
    "height": 1080,
    "fps": 30,
    "target_duration": 40,
    "exports": [
      "16:9"
    ]
  },
  "engine": {
    "default": "hyperframes",
    "dimension": "2d",
    "versions": {
      "hyperframes": "0.8.181"
    }
  },
  "services": {
    "tts": false,
    "lemo": false,
    "anatomy": false,
    "remotion": false
  },
  "gates": {
    "setup": {
      "done": true,
      "at": "2026-10-21T05:09:26.431Z"
    },
    "brief": {
      "done": true,
      "at": "2026-10-21T05:09:26.486Z",
      "hash": "b648a7956e3ac83db67ad21307f6d10fb8d61c758005afce78472a0c5a7228af"
    },
    "script": {
      "done": true,
      "at": "2026-10-21T05:09:26.534Z",
      "hash": "d0af3117f484ee49d04fc406a6ec8934b9f25aae4ed3113acd96b4bc2df15b60"
    },
    "storyboard": {
      "done": true,
      "at": "2026-10-21T05:41:52.294Z",
      "hash": "41cba190c9b89a1c3750c675b04ccd9fecbbbcb73d93497d03bdf9200df5fcf9"
    },
    "estimate": {
      "done": true,
      "at": "2026-10-21T05:41:52.344Z",
      "hash": "41cba190c9b89a1c3750c675b04ccd9fecbbbcb73d93497d03bdf9200df5fcf9"
    }
  },
  "scenes": [
    {
      "id": "s01",
      "hash": null,
      "approved_hash": null,
      "clip": null,
      "duration": null,
      "status": "built"
    },
    {
      "id": "s02",
      "hash": null,
      "approved_hash": null,
      "clip": null,
      "duration": null,
      "status": "built"
    },
    {
      "id": "s03",
      "hash": null,
      "approved_hash": null,
      "clip": null,
      "duration": null,
      "status": "built"
    },
    {
      "id": "s04",
      "hash": null,
      "approved_hash": null,
      "clip": null,
      "duration": null,
      "status": "built"
    }
  ],
  "audio": {
    "tts": {
      "vi": {
        "base_url": "http://localhost:8000",
        "model": "zerotts",
        "voice": "default",
        "format": "wav",
        "key_env": "ONE_STUDIO_TTS_KEY_VI"
      },
      "default": {
        "base_url": "http://localhost:8001",
        "model": "omnivoice",
        "voice": "default",
        "format": "wav",
        "key_env": "ONE_STUDIO_TTS_KEY"
      }
    },
    "music": null,
    "sfx": false,
    "loudness": -14,
    "sentence_pause": 0.25,
    "scene_padding": 0.5
  },
  "render": {
    "quality": "looks",
    "preview_height": 540,
    "out_dir": "out",
    "codec": "h264",
    "pix_fmt": "yuv420p"
  },
  "credit": {
    "warn_scenes": 8,
    "warn_types": [
      "3d",
      "character",
      "explainer"
    ]
  }
}
